{
  "automationMapContract": {
    "canonicalEntries": 101,
    "canonicalPath": "hubitat_automation_map_app_integration_registry.json",
    "label": "Protected Automation Map contract",
    "relationship": "Read-only protected input; general community projections never broaden or rewrite it.",
    "requiredForSite": false,
    "schemaVersion": "0.4",
    "siteRequiredForAutomationMap": false,
    "slimEntries": 82,
    "slimPath": "hubitat_automation_map_app_integration_registry_slim.json"
  },
  "counts": {
    "sources": 10,
    "states": {
      "DEGRADED": 3,
      "HEALTHY": 6,
      "MANUALLY_REVIEWED": 1,
      "STALE": 0,
      "UNAVAILABLE": 0
    }
  },
  "dataset": "community-utilities-site-status",
  "flow": [
    {
      "description": "Read bounded public JSON, documentation, wiki and source evidence.",
      "id": "acquire",
      "label": "Acquire"
    },
    {
      "description": "Check shape, provenance, limits and last-good promotion rules.",
      "id": "validate",
      "label": "Validate"
    },
    {
      "description": "Build independent catalogues, metrics, histories and search indexes.",
      "id": "project",
      "label": "Project"
    },
    {
      "description": "Deploy static browser-only Community Utilities through GitHub Pages.",
      "id": "publish",
      "label": "Publish"
    }
  ],
  "generatedAt": "2026-10-22T05:13:46Z",
  "lastSuccessfulHpmCrawl": "2026-10-22T05:05:54Z",
  "method": {
    "automationMapRegistriesWritten": false,
    "failedBuildReplacesOutput": false,
    "fileModificationTimesUsedAsCrawlTime": false,
    "remoteContentRendered": false,
    "unknownAcquisitionTimesRemainNull": true
  },
  "repositoryUrl": "https://github.com/GordonThelander/HPM_Manifest_Crawl",
  "schemaVersion": "1.0",
  "sources": [
    {
      "acquisition": "Bounded JSON acquisition",
      "authority": "HPM community registry",
      "evidence": "Retained successful crawl declares 224 repositories.",
      "id": "hpm-master-list",
      "lastAttempt": "2026-10-22T05:05:54Z",
      "lastSuccess": "2026-10-22T05:05:54Z",
      "name": "HPM master repository list",
      "observedAt": "2026-10-22T05:13:46Z",
      "outputs": [
        "hpm_package_index.json"
      ],
      "recordsProduced": 224,
      "retainedSnapshot": "2026-10-22T05:05:54Z",
      "role": "Declares the public developer repository files crawled by this project.",
      "sourceUpdatedAt": null,
      "state": "HEALTHY",
      "url": "https://raw.githubusercontent.com/HubitatCommunity/hubitat-packagerepositories/master/repositories.json"
    },
    {
      "acquisition": "Declared repository and manifest JSON acquisition",
      "authority": "Community publishers",
      "evidence": "223 of 224 repositories were fetched; 13 bounded acquisition or validation errors were retained.",
      "id": "developer-repositories",
      "lastAttempt": "2026-10-22T05:05:54Z",
      "lastSuccess": "2026-10-22T05:05:54Z",
      "name": "Developer repositories and package manifests",
      "observedAt": "2026-10-22T05:13:46Z",
      "outputs": [
        "hpm_package_index.json",
        "community_packages.json",
        "definitions.json"
      ],
      "recordsProduced": 938,
      "retainedSnapshot": "2026-10-22T05:05:54Z",
      "role": "Supplies package identity, metadata, links, apps, drivers and manifest versions.",
      "sourceUpdatedAt": null,
      "state": "DEGRADED",
      "url": "https://raw.githubusercontent.com/HubitatCommunity/hubitat-packagerepositories/master/repositories.json"
    },
    {
      "acquisition": "Bounded text acquisition from manifest-declared source URLs",
      "authority": "Community publishers",
      "evidence": "2300 of 2310 distinct source URLs were fetched; 10 failures remain explicit.",
      "id": "groovy-sources",
      "lastAttempt": "2026-10-22T05:05:54Z",
      "lastSuccess": "2026-10-22T05:05:54Z",
      "name": "Public Groovy app and driver sources",
      "observedAt": "2026-10-22T05:13:46Z",
      "outputs": [
        "definitions.json",
        "network_evidence.json"
      ],
      "recordsProduced": 2324,
      "retainedSnapshot": "2026-10-22T05:05:54Z",
      "role": "Provides source identity and static network observations for declared components.",
      "sourceUpdatedAt": null,
      "state": "DEGRADED",
      "url": "https://raw.githubusercontent.com/HubitatCommunity/hubitat-packagerepositories/master/repositories.json"
    },
    {
      "acquisition": "Bounded JSON acquisition with retained fallback",
      "authority": "HPM community registry",
      "evidence": "Current mode is live; taxonomy snapshot validates.",
      "id": "hpm-settings",
      "lastAttempt": "2026-10-22T05:12:23Z",
      "lastSuccess": "2026-10-22T05:12:23Z",
      "name": "Authoritative HPM settings",
      "observedAt": "2026-10-22T05:13:46Z",
      "outputs": [
        "hpm_taxonomy.json"
      ],
      "recordsProduced": 52,
      "retainedSnapshot": "2ba3867d83885d3fb51106ae0e556465c24727268a7d324641961cc94a928e0e",
      "role": "Defines the current valid package categories and tags.",
      "sourceUpdatedAt": null,
      "state": "HEALTHY",
      "url": "https://raw.githubusercontent.com/HubitatCommunity/hubitat-packagerepositories/master/settings.json"
    },
    {
      "acquisition": "Bounded documentation-table harvest",
      "authority": "Hubitat documentation",
      "evidence": "A failed harvest never commits, so reaching this status page is itself proof the harvest just attempted and succeeded; last attempt and last success both reflect this build's run time, since catalogue schema 1.0 does not embed a per-run timestamp in the file itself.",
      "id": "official-devices",
      "lastAttempt": "2026-10-22T05:13:46Z",
      "lastSuccess": "2026-10-22T05:13:46Z",
      "name": "Compatible Devices catalogue",
      "observedAt": "2026-10-22T05:13:46Z",
      "outputs": [
        "official_devices.json"
      ],
      "recordsProduced": 1089,
      "retainedSnapshot": "06a9942d5b41f6175d647944852525cd4b48c63f4850fe6db3677bf2d91976d2",
      "role": "Lists officially documented compatible devices, protocols and recommended drivers.",
      "sourceUpdatedAt": null,
      "state": "HEALTHY",
      "url": "https://docs2.hubitat.com/en/devices/list-of-compatible-devices"
    },
    {
      "acquisition": "Bounded documentation index acquisition",
      "authority": "Hubitat documentation",
      "evidence": "35 native entries matched across 55 documentation pages.",
      "id": "official-app-docs",
      "lastAttempt": "2026-10-22T05:05:54Z",
      "lastSuccess": "2026-10-22T05:05:54Z",
      "name": "Official app documentation index",
      "observedAt": "2026-10-22T05:13:46Z",
      "outputs": [
        "hubitat_official_docs_index.json"
      ],
      "recordsProduced": 55,
      "retainedSnapshot": "2026-10-22T05:05:54Z",
      "role": "Matches documented built-in apps to the protected Automation Map registry.",
      "sourceUpdatedAt": null,
      "state": "HEALTHY",
      "url": "https://docs2.hubitat.com/apps"
    },
    {
      "acquisition": "Discourse JSON first-post harvest",
      "authority": "Hubitat Community wiki",
      "evidence": "A failed harvest never commits, so reaching this status page is itself proof the harvest just attempted and succeeded; last attempt and last success both reflect this build's run time, since catalogue schema 1.0 does not embed a per-run timestamp in the file itself.",
      "id": "community-driver-wiki",
      "lastAttempt": "2026-10-22T05:13:46Z",
      "lastSuccess": "2026-10-22T05:13:46Z",
      "name": "Custom Device Drivers Wiki",
      "observedAt": "2026-10-22T05:13:46Z",
      "outputs": [
        "community_drivers.json"
      ],
      "recordsProduced": 536,
      "retainedSnapshot": "f8fec102807de4198f8456fab98b12fa79e90872e3345bc272cd5e78be631824",
      "role": "Provides community-curated driver listings and lifecycle wording.",
      "sourceUpdatedAt": "2026-05-22T15:10:53.314Z",
      "state": "HEALTHY",
      "url": "https://community.hubitat.com/t/custom-device-drivers-wiki/465"
    },
    {
      "acquisition": "Discourse JSON first-post harvest",
      "authority": "Hubitat Community wiki",
      "evidence": "A failed harvest never commits, so reaching this status page is itself proof the harvest just attempted and succeeded; last attempt and last success both reflect this build's run time, since catalogue schema 1.0 does not embed a per-run timestamp in the file itself.",
      "id": "community-app-wiki",
      "lastAttempt": "2026-10-22T05:13:46Z",
      "lastSuccess": "2026-10-22T05:13:46Z",
      "name": "Custom Apps Wiki",
      "observedAt": "2026-10-22T05:13:46Z",
      "outputs": [
        "community_apps.json"
      ],
      "recordsProduced": 80,
      "retainedSnapshot": "883ac42c9051bdeb281176bccbd96b6325c1f374e0a2f6f33e982062b24beac4",
      "role": "Provides community-curated app listings and lifecycle wording.",
      "sourceUpdatedAt": "2024-08-15T10:12:19.442Z",
      "state": "HEALTHY",
      "url": "https://community.hubitat.com/t/custom-apps-wiki/501"
    },
    {
      "acquisition": "Explicit maintainer review",
      "authority": "Maintainer-reviewed public evidence",
      "evidence": "Each retained project requires reviewed source identity and public evidence links; the hash above identifies exactly which reviewed file this snapshot validated. There is no fetch step to time, since a maintainer edits this file directly.",
      "id": "reviewed-manual-projects",
      "lastAttempt": null,
      "lastSuccess": null,
      "name": "Reviewed manual community projects",
      "observedAt": "2026-10-22T05:13:46Z",
      "outputs": [
        "reviewed_community_projects.json"
      ],
      "recordsProduced": 1,
      "retainedSnapshot": "12398e2363afdf12f8c9f735c624219e3468b95f3cf5f11eaa8e657e3b5f9f61",
      "role": "Adds source-confirmed manual-install projects absent from HPM and wiki snapshots.",